{
    "$schema": "https://hyperlink.surf/schemas/AuthManifest_v2.json",
    "version": 2,
    "methods": [
        "static"
    ],
    "host_name": "HyperlinkVR",
    "open_for_registration": true,
    "static_submit_hint": "If you're a key contributor, open a PR on the web repo",
    "hypergram_read_api_base": "https://hypergram-api.hyperlink.surf"
}